filepath,source,label,text,idx
data/raw/iam/iam_04708.png,iam,genuine,"into being in April , 1958 , with Dr. Andrew Hood as",4708
data/raw/iam/iam_04709.png,iam,genuine,"tober , 1959 , the first experimental day-release course for",4709
data/raw/iam/iam_04710.png,iam,genuine,to let older employees attend day-release courses on preparation,4710
data/raw/iam/iam_04711.png,iam,genuine,men was organised . Eleven students from seven firms atten-,4711
data/raw/iam/iam_04712.png,iam,genuine,"of Education for Glasgow , that industrial firms might be ready",4712
data/raw/iam/iam_04713.png,iam,genuine,to the men and their employers that the venture was an,4713
data/raw/iam/iam_04714.png,iam,genuine,experiment from which the organisers hoped to learn as much,4714
data/raw/iam/iam_04715.png,iam,genuine,ded a course on six full Fridays and it was made clear both,4715
data/raw/iam/iam_04716.png,iam,genuine,"for retirement , their wages paid for the time thus spent . An",4716
data/raw/iam/iam_04717.png,iam,genuine,"In 1959 it was suggested by Mr. T. M. Banks , Assistant Director",4717
data/raw/iam/iam_04718.png,iam,genuine,as the participants .,4718
data/raw/iam/iam_04719.png,iam,genuine,approach was made to about twenty large firms and in Oc-,4719
data/raw/iam/iam_04720.png,iam,genuine,and retirement according to the occupational,4720
data/raw/iam/iam_04721.png,iam,genuine,in what aspects ? 3 . Does the evidence,4721
data/raw/iam/iam_04722.png,iam,genuine,"level of employees ? 2 . If so , which occupational",4722
data/raw/iam/iam_04723.png,iam,genuine,a pre-retirement planning and preparation,4723
data/raw/iam/iam_04724.png,iam,genuine,levels are the better or the poorer prepared,4724
data/raw/iam/iam_04725.png,iam,genuine,obtained support a rationale for adapting,4725
data/raw/iam/iam_04726.png,iam,genuine,programme to the needs of older employees,4726
data/raw/iam/iam_04727.png,iam,genuine,1 . Are there differences in adjustment to ageing,4727
data/raw/iam/iam_04728.png,iam,genuine,for successful adjustment to retirement and,4728
data/raw/iam/iam_04729.png,iam,genuine,of different occupational levels ?,4729
data/raw/iam/iam_04730.png,iam,genuine,itself . Remember your four names - have the list,4730
data/raw/iam/iam_04731.png,iam,genuine,with you if you like - and you simply can't,4731
data/raw/iam/iam_04732.png,iam,genuine,"be flummoxed ! Of course , in any speech a good",4732
data/raw/iam/iam_04733.png,iam,genuine,start and a good finish are half the battle .,4733
data/raw/iam/iam_04734.png,iam,genuine,things in a different way . All the better ! - it will,4734
data/raw/iam/iam_04735.png,iam,genuine,sound much more spontaneous on the occasion,4735
data/raw/iam/iam_04736.png,iam,genuine,Each time you rehearse you will probably put,4736
data/raw/iam/iam_04737.png,iam,genuine,But there is no need to be frightened . The audience,4737
data/raw/iam/iam_04738.png,iam,genuine,"So - see the next page ! Yes , they are waiting for you .",4738
data/raw/iam/iam_04739.png,iam,genuine,I have not had much experience of public speaking .,4739
data/raw/iam/iam_04740.png,iam,genuine,you offer them . A good start will put them in a,4740
data/raw/iam/iam_04741.png,iam,genuine,will eat out of your hand - if they like what,4741
data/raw/iam/iam_04742.png,iam,genuine,good humour . Ladies and gentlemen ! I 'm afraid,4742
data/raw/iam/iam_04743.png,iam,genuine,"rate , have proved that wrong . And they say , too ,",4743
data/raw/iam/iam_04744.png,iam,genuine,intelligence .,4744
data/raw/iam/iam_04745.png,iam,genuine,are a novice ? It 's their interest you want - not their,4745
data/raw/iam/iam_04746.png,iam,genuine,GO ! Try something like this : It is said that tele-,4746
data/raw/iam/iam_04747.png,iam,genuine,sympathy . And you want to get it from the word,4747
data/raw/iam/iam_04748.png,iam,genuine,But that 's a terrible way to begin ! Why tell them you,4748
data/raw/iam/iam_04749.png,iam,genuine,"vision keeps people at home . But you , at any",4749
data/raw/iam/iam_04750.png,iam,genuine,that television makes its appeal to those of lesser,4750
data/raw/iam/iam_04751.png,iam,genuine,May I suggest that you have proved that,4751
data/raw/iam/iam_04752.png,iam,genuine,"your speech . Take some thought , too , for your ending .",4752
data/raw/iam/iam_04753.png,iam,genuine,didn't get in ! Instead he might have ended,4753
data/raw/iam/iam_04754.png,iam,genuine,"this way : Well , those are my views .",4754
data/raw/iam/iam_04755.png,iam,genuine,candidate often used that finish . No wonder he,4755
data/raw/iam/iam_04756.png,iam,genuine,Thank you for listening to me so patiently . A political,4756
data/raw/iam/iam_04757.png,iam,genuine,right ! Congratulations ! And away you go into,4757
data/raw/iam/iam_04758.png,iam,genuine,"Camp , aged thirty-three , the girl who was to have",4758
data/raw/iam/iam_04759.png,iam,genuine,been his bride . There was little doubt of how,4759
data/raw/iam/iam_04760.png,iam,genuine,grief-stricken duty formally to identify Elizabeth,4760
data/raw/iam/iam_04761.png,iam,genuine,taken to St Thomas's Hospital it was his,4761
data/raw/iam/iam_04762.png,iam,genuine,had been murder .,4762
data/raw/iam/iam_04763.png,iam,genuine,"became greatly alarmed , and after the body had been",4763
data/raw/iam/iam_04764.png,iam,genuine,"she had met her death , and even less that it",4764
data/raw/iam/iam_04765.png,iam,genuine,When he learned what was causing the commotion he,4765
data/raw/iam/iam_04766.png,iam,genuine,She had been struck several times with a blunt,4766
data/raw/iam/iam_04767.png,iam,genuine,"There were signs of a violent struggle , blood",4767
data/raw/iam/iam_04768.png,iam,genuine,to provide the only possible clue to the killer .,4768
data/raw/iam/iam_04769.png,iam,genuine,"on the cushions and floor , and the remains",4769
data/raw/iam/iam_04770.png,iam,genuine,of her broken umbrella . But a pair of bone,4770
data/raw/iam/iam_04771.png,iam,genuine,"instrument , and her head was smashed in .",4771
data/raw/iam/iam_04772.png,iam,genuine,cuff-links found in the compartment seemed,4772
data/raw/iam/iam_04773.png,iam,genuine,"in the evening she had called on her two sisters ,",4773
data/raw/iam/iam_04774.png,iam,genuine,"robbery , and this was further confirmed when a",4774
data/raw/iam/iam_04775.png,iam,genuine,"other at Hounslow , where she kept a shop .",4775
data/raw/iam/iam_04776.png,iam,genuine,check was made with the woman's relations in,4776
data/raw/iam/iam_04777.png,iam,genuine,"Good Intent , a public-house in Walworth . Her day",4777
data/raw/iam/iam_04778.png,iam,genuine,Hounslow . Miss Camp had been the housekeeper at the,4778
data/raw/iam/iam_04779.png,iam,genuine,established that no sexual assault had taken place .,4779
data/raw/iam/iam_04780.png,iam,genuine,one of whom lived at Hammersmith and the,4780
data/raw/iam/iam_04781.png,iam,genuine,"The body was examined , and it was definitely",4781
data/raw/iam/iam_04782.png,iam,genuine,It seemed probable that the motive had been,4782
data/raw/iam/iam_04783.png,iam,genuine,"off was Thursday , and before coming up to London",4783
data/raw/iam/iam_04784.png,iam,genuine,"and arrived at Hounslow around 5 P.M. , where",4784
data/raw/iam/iam_04785.png,iam,genuine,"to the station , helping her with some of",4785
data/raw/iam/iam_04786.png,iam,genuine,"she had tea with her other sister , and then",4786
data/raw/iam/iam_04787.png,iam,genuine,her packages . This sister was able to establish,4787
data/raw/iam/iam_04788.png,iam,genuine,that she had carried a green purse and,4788
data/raw/iam/iam_04789.png,iam,genuine,had bought a railway ticket .,4789
data/raw/iam/iam_04790.png,iam,genuine,went to catch the 7.42 . Her sister saw her,4790
data/raw/iam/iam_04791.png,iam,genuine,"Elizabeth had left Hammersmith in the late afternoon ,",4791
data/raw/iam/iam_04792.png,iam,genuine,was found at Waterloo . Neither the sisters nor Mr Berry thought it,4792
data/raw/iam/iam_04793.png,iam,genuine,"compartment when the train left , but this did not help much , since it",4793
data/raw/iam/iam_04794.png,iam,genuine,supported the sister's statement that Elizabeth Camp had been alone in her,4794
data/raw/iam/iam_04795.png,iam,genuine,likely that she had been carrying much money . A porter at Hounslow,4795
data/raw/iam/iam_04796.png,iam,genuine,had made stops at nine stations before Waterloo .,4796
data/raw/iam/iam_04797.png,iam,genuine,"But both purse and ticket , and the packages , were gone when the body",4797
data/raw/iam/iam_04798.png,iam,genuine,killer to book in modern times .,4798
data/raw/iam/iam_04799.png,iam,genuine,"no easy task , but one in which patience and method",4799
data/raw/iam/iam_04800.png,iam,genuine,and perhaps evidence enough to have brought a,4800
data/raw/iam/iam_04801.png,iam,genuine,"sticking to it . The murder weapon , more than likely ,",4801
data/raw/iam/iam_04802.png,iam,genuine,Putney and Wandsworth they found a bloodstained,4802
data/raw/iam/iam_04803.png,iam,genuine,"pestle such as chemists use , with some hairs",4803
data/raw/iam/iam_04804.png,iam,genuine,The police began a systematic search of the line -,4804
data/raw/iam/iam_04805.png,iam,genuine,paid off . At a spot on the embankment between,4805
data/raw/iam/iam_04806.png,iam,genuine,might have yielded . It was a tough case to,4806
data/raw/iam/iam_04807.png,iam,genuine,no experts to check and photograph any ' dabs ' it,4807
data/raw/iam/iam_04808.png,iam,genuine,"disguised another motive , and a thorough check",4808
data/raw/iam/iam_04809.png,iam,genuine,overlook the possibility that this might have,4809
data/raw/iam/iam_04810.png,iam,genuine,"Police , and Chief Inspector Marshall , of Scotland",4810
data/raw/iam/iam_04811.png,iam,genuine,"attacked for the sake of robbery , they did not",4811
data/raw/iam/iam_04812.png,iam,genuine,"Yard , combined forces in the investigation . While",4812
data/raw/iam/iam_04813.png,iam,genuine,"tackle , and Superintendent Robinson , of the L.S.W.R.",4813
data/raw/iam/iam_04814.png,iam,genuine,accepting the likelihood that Miss Camp had been,4814
data/raw/iam/iam_04815.png,iam,genuine,"But in 1897 , alas ! there was no fingerprint bureau ,",4815
data/raw/iam/iam_04816.png,iam,genuine,of her former men friends and acquaintances began .,4816
data/raw/iam/iam_04817.png,iam,genuine,one of that new class of merchant financiers,4817
data/raw/iam/iam_04818.png,iam,genuine,"harrying English shipping as far away as Cherbourg ,",4818
data/raw/iam/iam_04819.png,iam,genuine,"resources , and captured the young Mercer in a",4819
data/raw/iam/iam_04820.png,iam,genuine,A Scottish knight - Sir John Mercer - was,4820
data/raw/iam/iam_04821.png,iam,genuine,"which the city of London was now producing , fitted ,",4821
data/raw/iam/iam_04822.png,iam,genuine,equipped and manned a fleet from his own,4822
data/raw/iam/iam_04823.png,iam,genuine,"imprisoned in England . His son , in revenge , was",4823
data/raw/iam/iam_04824.png,iam,genuine,brilliant Channel fight .,4824
data/raw/iam/iam_04825.png,iam,genuine,"and doing it to some purpose . John Philpot ,",4825
data/raw/iam/iam_04826.png,iam,genuine,a walk over the fields while we attended,4826
data/raw/iam/iam_04827.png,iam,genuine,"rather indignant , but we took the",4827
data/raw/iam/iam_04828.png,iam,genuine,a farmer in a field . He seemed,4828
data/raw/iam/iam_04829.png,iam,genuine,said he had been stopped by,4829
data/raw/iam/iam_04830.png,iam,genuine,"after the Dedication , the Archbishop",4830
data/raw/iam/iam_04831.png,iam,genuine,when we met at tea at the rectory,4831
data/raw/iam/iam_04832.png,iam,genuine,"to our business . To my amusement ,",4832
data/raw/iam/iam_04833.png,iam,genuine,episode without a smile till afterwards .,4833
data/raw/iam/iam_04834.png,iam,genuine,Dr. Davidson said he would go for,4834
data/raw/iam/iam_04835.png,iam,genuine,"The Hall proved most useful , especially in winter",4835
data/raw/iam/iam_04836.png,iam,genuine,"was translated to Winchester , and Dr. Hubert",4836
data/raw/iam/iam_04837.png,iam,genuine,coming to Sunday Evensong . We managed to furnish,4837
data/raw/iam/iam_04838.png,iam,genuine,Burge became Bishop of Southwark .,4838
data/raw/iam/iam_04839.png,iam,genuine,appreciated the Church Hall for worship as well,4839
data/raw/iam/iam_04840.png,iam,genuine,when the distance to the church deterred many from,4840
data/raw/iam/iam_04841.png,iam,genuine,"a table with cross and candles , and the people",4841
data/raw/iam/iam_04842.png,iam,genuine,as for more secular purposes . In 1910 Dr. Talbot,4842
data/raw/iam/iam_04843.png,iam,genuine,the incumbent of the highest church in the,4843
data/raw/iam/iam_04844.png,iam,genuine,"religious instruction through the Diocese , and I",4844
data/raw/iam/iam_04845.png,iam,genuine,Meanwhile I had been asked to do a bit of Diocesan,4845
data/raw/iam/iam_04846.png,iam,genuine,also found myself a member of the Diocesan,4846
data/raw/iam/iam_04847.png,iam,genuine,Diocese .,4847
data/raw/iam/iam_04848.png,iam,genuine,"work in connection with Higher Religious Education , and",4848
data/raw/iam/iam_04849.png,iam,genuine,to become the Southwark Secretary of the Church Reading,4849
data/raw/iam/iam_04850.png,iam,genuine,Union . This meant organizing lectures and courses of,4850
data/raw/iam/iam_04851.png,iam,genuine,"Conference , where I remember introducing myself as",4851
data/raw/iam/iam_04852.png,iam,genuine,There was a somewhat shocked atmosphere in,4852
data/raw/iam/iam_04853.png,iam,genuine,"work was growing pretty heavy , and we managed",4853
data/raw/iam/iam_04854.png,iam,genuine,was 800 feet high above the sea level ! The,4854
data/raw/iam/iam_04855.png,iam,genuine,"some quarters , until I explained that my church",4855
data/raw/iam/iam_04856.png,iam,genuine,to get a stipendiary layman who could help,4856
data/raw/iam/iam_04857.png,iam,genuine,among the children and young people .,4857
data/raw/iam/iam_04858.png,iam,genuine,in Bavaria to witness the Passion Play . The place and its people were,4858
data/raw/iam/iam_04859.png,iam,genuine,"performed at the small theatre in the village , when new talent would",4859
data/raw/iam/iam_04860.png,iam,genuine,"war broke out in 1914 , I spent my summer holidays there and became",4860
data/raw/iam/iam_04861.png,iam,genuine,be discovered and trained .,4861
data/raw/iam/iam_04862.png,iam,genuine,to play an important part in my life . For five years in succession till,4862
data/raw/iam/iam_04863.png,iam,genuine,very intimate with the people and the environs . Every year between the,4863
data/raw/iam/iam_04864.png,iam,genuine,"Passion Plays , an interval of ten years , another play would be",4864
data/raw/iam/iam_04865.png,iam,genuine,It was while I was at Tatsfield that I first visited Oberammergau,4865
data/raw/iam/iam_04866.png,iam,genuine,the end of a few months an enthusiastic choir of men and women,4866
data/raw/iam/iam_04867.png,iam,genuine,and lead the others . As for basses and altos the conductor had to,4867
data/raw/iam/iam_04868.png,iam,genuine,First of all simple part-songs : I found only one member who had,4868
data/raw/iam/iam_04869.png,iam,genuine,old school friend at Clifton . He could sustain the tenor part quite well,4869
data/raw/iam/iam_04870.png,iam,genuine,could render simple part-singing tolerably well .,4870
data/raw/iam/iam_04871.png,iam,genuine,any idea of reading music . This was the village doctor who was an,4871
data/raw/iam/iam_04872.png,iam,genuine,"teach by singing the parts with them . It was very amusing , and by",4872
data/raw/iam/iam_04873.png,iam,genuine,and we were all happy .,4873
data/raw/iam/iam_04874.png,iam,genuine,"gave a concert at which the accompanist was the village schoolmaster ,",4874
data/raw/iam/iam_04875.png,iam,genuine,Then we went to work on Coleridge Taylor's ' Hiawatha's,4875
data/raw/iam/iam_04876.png,iam,genuine,"Wedding Feast . ' Enthusiasm grew , and in a few more months we",4876
data/raw/iam/iam_04877.png,iam,genuine,"Friends from Limpsfield , in addition to the villagers , came up ,",4877
data/raw/iam/iam_04878.png,iam,genuine,and the tenor solo ' Onaway awake ' was sung by the Rector .,4878
data/raw/iam/iam_04879.png,iam,genuine,years a most able and devoted housekeeper whom I had known,4879
data/raw/iam/iam_04880.png,iam,genuine,church .,4880
data/raw/iam/iam_04881.png,iam,genuine,well in Limpsfield where she had a house next to the,4881
data/raw/iam/iam_04882.png,iam,genuine,Very soon we managed to get a hut in Purley where soldiers,4882
data/raw/iam/iam_04883.png,iam,genuine,in those years more than busy . We now had a vicarage next,4883
data/raw/iam/iam_04884.png,iam,genuine,"to the church , and I was most fortunate in having for eight",4884
data/raw/iam/iam_04885.png,iam,genuine,were very welcome and the ladies organized a canteen . Life was,4885
data/raw/iam/iam_04886.png,iam,genuine,On hearing that I was to leave Tatsfield and come to,4886
data/raw/iam/iam_04887.png,iam,genuine,who was the only other occupant of the house when,4887
data/raw/iam/iam_04888.png,iam,genuine,Purley she offered to come and look after me . She was,4888
data/raw/iam/iam_04889.png,iam,genuine,Mr. Evitt had gone .,4889
data/raw/iam/iam_04890.png,iam,genuine,"a real treasure , of yeoman stock and clever in all domestic",4890
data/raw/iam/iam_04891.png,iam,genuine,"things , a widow who knew how to look after the ' boy , '",4891
data/raw/iam/iam_04892.png,iam,genuine,picture given them and the lesson was,4892
data/raw/iam/iam_04893.png,iam,genuine,ster at her own home . Each child had a,4893
data/raw/iam/iam_04894.png,iam,genuine,the superintendent who filled in the regi-,4894
data/raw/iam/iam_04895.png,iam,genuine,had to miss the Sunday Church from any cause,4895
data/raw/iam/iam_04896.png,iam,genuine,"church , they could just whisper to",4896
data/raw/iam/iam_04897.png,iam,genuine,We gathered together a splendid Sunday,4897
data/raw/iam/iam_04898.png,iam,genuine,clamour for back stamps if a child,4898
data/raw/iam/iam_04899.png,iam,genuine,"their book , and there was quite a",4899
data/raw/iam/iam_04900.png,iam,genuine,largely based on this . It was on a,4900
data/raw/iam/iam_04901.png,iam,genuine,"afternoon service at the church , each child",4901
data/raw/iam/iam_04902.png,iam,genuine,stamp which could be stuck in,4902
data/raw/iam/iam_04903.png,iam,genuine,"being given a number which , as they came into",4903
data/raw/iam/iam_04904.png,iam,genuine,naughty child with the penalty of not being,4904
data/raw/iam/iam_04905.png,iam,genuine,"the children enjoyed the service , and I heard",4905
data/raw/iam/iam_04906.png,iam,genuine,are parents or even grandparents,4906
data/raw/iam/iam_04907.png,iam,genuine,"they were a most delightful lot , and",4907
data/raw/iam/iam_04908.png,iam,genuine,it is a great joy to meet them now,4908
data/raw/iam/iam_04909.png,iam,genuine,on Sunday afternoon . I hope the threat,4909
data/raw/iam/iam_04910.png,iam,genuine,"kept them good in the week , but anyway",4910
data/raw/iam/iam_04911.png,iam,genuine,allowed to come to the Children's Church,4911
data/raw/iam/iam_04912.png,iam,genuine,It was quite amusing to see how much,4912
data/raw/iam/iam_04913.png,iam,genuine,of parents or faithful nurses threaten any,4913
data/raw/iam/iam_04914.png,iam,genuine,fifty years afterwards when so many,4914
data/raw/iam/iam_04915.png,iam,genuine,me at once to chronicle a most intimate and,4915
data/raw/iam/iam_04916.png,iam,genuine,sons was just coming into the world in this year,4916
data/raw/iam/iam_04917.png,iam,genuine,lasting friendship begun in 1913 in Purley and,4917
data/raw/iam/iam_04918.png,iam,genuine,"and his family , the youngest of whose three",4918
data/raw/iam/iam_04919.png,iam,genuine,"to St. Mark's , the first contact I made was",4919
data/raw/iam/iam_04920.png,iam,genuine,Speaking of churchwardens and children leads,4920
data/raw/iam/iam_04921.png,iam,genuine,"with the Vicar's Warden , Mr. F. W. Charlton",4921
data/raw/iam/iam_04922.png,iam,genuine,of 1913 .,4922
data/raw/iam/iam_04923.png,iam,genuine,continuing till old age to-day . When I went,4923
data/raw/iam/iam_04924.png,iam,genuine,From then till now the acquaintance ripened into a very,4924
data/raw/iam/iam_04925.png,iam,genuine,all the many vicissitudes of a long ministry . Mr. and,4925
data/raw/iam/iam_04926.png,iam,genuine,Mrs. Charlton have been from the first difficult,4926
data/raw/iam/iam_04927.png,iam,genuine,"some tempers were easily frayed , the most",4927
data/raw/iam/iam_04928.png,iam,genuine,deep friendship which I have taken with me through,4928
data/raw/iam/iam_04929.png,iam,genuine,loyal and devoted friends .,4929
data/raw/iam/iam_04930.png,iam,genuine,"years of war , when most lives were upset and",4930
data/raw/iam/iam_04931.png,iam,genuine,lived on in Purley - have always been,4931
data/raw/iam/iam_04932.png,iam,genuine,were in our Children's Church from the,4932
data/raw/iam/iam_04933.png,iam,genuine,another we do not forget .,4933
data/raw/iam/iam_04934.png,iam,genuine,"outset , and when we don't see one",4934
data/raw/iam/iam_04935.png,iam,genuine,"failed . Their three boys , now successful men ,",4935
data/raw/iam/iam_04936.png,iam,genuine,Their homes - for since those years they have,4936
data/raw/iam/iam_04937.png,iam,genuine,"havens of rest , and the welcome has never",4937
data/raw/iam/iam_04938.png,iam,genuine,"frequently , establishing at once a friendly contact with",4938
data/raw/iam/iam_04939.png,iam,genuine,"at the Royal Herbert Hospital , full of war prisoners .",4939
data/raw/iam/iam_04940.png,iam,genuine,"In those early years 1914-18 , life was very full",4940
data/raw/iam/iam_04941.png,iam,genuine,both in the parish and in the wider war activities .,4941
data/raw/iam/iam_04942.png,iam,genuine,"The Bishop , knowing that I spent my holidays in",4942
data/raw/iam/iam_04943.png,iam,genuine,"Bavaria , asked me if I would do something for two wards",4943
data/raw/iam/iam_04944.png,iam,genuine,the Bavarian wounded who were delighted to find,4944
data/raw/iam/iam_04945.png,iam,genuine,"I was very glad to help in this way , and visited them",4945
data/raw/iam/iam_04946.png,iam,genuine,someone who knew their native villages .,4946
data/raw/iam/iam_04947.png,iam,genuine,scorned these more simple country folk .,4947
data/raw/iam/iam_04948.png,iam,genuine,I could at once notice the great antagonism,4948
data/raw/iam/iam_04949.png,iam,genuine,between the Bavarians and the Prussians who openly,4949
data/raw/iam/iam_04950.png,iam,genuine,"general system of "" francs-tireurs "" , to be named",4950
data/raw/iam/iam_04951.png,iam,genuine,lead to disaster . Then there had been much talk of,4951
data/raw/iam/iam_04952.png,iam,genuine,Less than no response from the Russian side led,4952
data/raw/iam/iam_04953.png,iam,genuine,""" Werewolves "" .",4953
data/raw/iam/iam_04954.png,iam,genuine,outcome that the Nazis evidently hoped might,4954
data/raw/iam/iam_04955.png,iam,genuine,one to fear that the event might well have the,4955
data/raw/iam/iam_04956.png,iam,genuine,the setting up among the German population of a,4956
data/raw/iam/iam_04957.png,iam,genuine,"thousand of Nazi rule , so far from creating",4957
data/raw/iam/iam_04958.png,iam,genuine,universally a dull bewildered apathy .,4958
data/raw/iam/iam_04959.png,iam,genuine,meeting of East and West was marked by,4959
data/raw/iam/iam_04960.png,iam,genuine,more than a fantasy . Thanks to the good,4960
data/raw/iam/iam_04961.png,iam,genuine,"sense of the front line soldiers , the",4961
data/raw/iam/iam_04962.png,iam,genuine,vodka . And the effect on the German people,4962
data/raw/iam/iam_04963.png,iam,genuine,of the first ten years of the promised,4963
data/raw/iam/iam_04964.png,iam,genuine,the use of no weapon more lethal than,4964
data/raw/iam/iam_04965.png,iam,genuine,"a spirit of warlike frenzy , had produced",4965
data/raw/iam/iam_04966.png,iam,genuine,The Nazi fortress concept turned out to be nothing,4966
data/raw/iam/iam_04967.png,iam,genuine,""" Werewolves "" that we had contemplated the necessity of very",4967
data/raw/iam/iam_04968.png,iam,genuine,special precautions to guard the lives of our airmen . Particular,4968
data/raw/iam/iam_04969.png,iam,genuine,"and death over Germany , causing such wholesale slaughter among",4969
data/raw/iam/iam_04970.png,iam,genuine,So far had our thinking led us in this matter of the,4970
data/raw/iam/iam_04971.png,iam,genuine,"men , women and children , old and young alike .",4971
data/raw/iam/iam_04972.png,iam,genuine,"those who had , over the years , spread such ghastly havoc , destruction",4972
data/raw/iam/iam_04973.png,iam,genuine,"hatred , we felt , was bound to be aimed at the representatives of",4973
data/raw/iam/iam_04974.png,iam,genuine,By the end of the month he still delighted in,4974
data/raw/iam/iam_04975.png,iam,genuine,is a great resource . Vesuvius seems to be tired ;,4975
data/raw/iam/iam_04976.png,iam,genuine,other man was a priest : here the priest is,4976
data/raw/iam/iam_04977.png,iam,genuine,much as his health permitted him to enjoy any-,4977
data/raw/iam/iam_04978.png,iam,genuine,Naples . He told Cloncurry that he enjoyed it as,4978
data/raw/iam/iam_04979.png,iam,genuine,1superceded by the soldier - a favourable change,4979
data/raw/iam/iam_04980.png,iam,genuine,fine . ',4980
data/raw/iam/iam_04981.png,iam,genuine,"thing . ' The Pearl ' , he wrote , ' is arrived , which",4981
data/raw/iam/iam_04982.png,iam,genuine,"people , and what a busy town . At Rome , every",4982
data/raw/iam/iam_04983.png,iam,genuine,"# he is going out fast ... . What a gay , lively",4983
data/raw/iam/iam_04984.png,iam,genuine,"in my eye , particularly as the troops are very",4984
data/raw/iam/iam_04985.png,iam,genuine,"permitted him to enjoy anything . ' The Pearl ' ,",4985
data/raw/iam/iam_04986.png,iam,genuine,every other man was a priest : here the,4986
data/raw/iam/iam_04987.png,iam,genuine,"he wrote , ' is arrived , which is a great",4987
