filepath,source,label,text,idx
data/raw/iam/iam_01797.png,iam,genuine,stricter in recalling existing overdrafts . This is underlined in,1797
data/raw/iam/iam_01798.png,iam,genuine,difficult to arrange a loan or overdraft . And banks will be,1798
data/raw/iam/iam_01799.png,iam,genuine,the Central Bank's weekly return ... ... which shows that more,1799
data/raw/iam/iam_01800.png,iam,genuine,"The big "" squeeze "" means that it is going to be more",1800
data/raw/iam/iam_01801.png,iam,genuine,"than 163,000,000 of the banks' money is now frozen in the",1801
data/raw/iam/iam_01802.png,iam,genuine,"instalment of almost 8,000,000",1802
data/raw/iam/iam_01803.png,iam,genuine,"this year . """,1803
data/raw/iam/iam_01804.png,iam,genuine,MR. KRUSCHEV raises the bogy of,1804
data/raw/iam/iam_01805.png,iam,genuine,in response to the Budgette appeal .,1805
data/raw/iam/iam_01806.png,iam,genuine,by September 20 . For nearly a year,1806
data/raw/iam/iam_01807.png,iam,genuine,"About another 70,000,000 is due",1807
data/raw/iam/iam_01808.png,iam,genuine,"about 150,000,000 has been frozen .",1808
data/raw/iam/iam_01809.png,iam,genuine,Banks have paid in a first,1809
data/raw/iam/iam_01810.png,iam,genuine,German militarism in his replies to,1810
data/raw/iam/iam_01811.png,iam,genuine,the West on Berlin . And he repeats,1811
data/raw/iam/iam_01812.png,iam,genuine,"that the problem "" must be solved",1812
data/raw/iam/iam_01813.png,iam,genuine,forces and arms to touch off a world war .,1813
data/raw/iam/iam_01814.png,iam,genuine,"treaty with Germany causes no real danger . West Germany ,",1814
data/raw/iam/iam_01815.png,iam,genuine,West Germany were published in Moscow yesterday . They,1815
data/raw/iam/iam_01816.png,iam,genuine,"hotbed of war danger in Europe . Even now , aided by",1816
data/raw/iam/iam_01817.png,iam,genuine,"with its militarists and revenge-seekers , is becoming a",1817
data/raw/iam/iam_01818.png,iam,genuine,"the U.S. , Britain and France , it has more than enough",1818
data/raw/iam/iam_01819.png,iam,genuine,The Notes to the Big Three and a memorandum to,1819
data/raw/iam/iam_01820.png,iam,genuine,tell : The U.S. - It is false to say the absence of a peace,1820
data/raw/iam/iam_01821.png,iam,genuine,put at the disposal of those very militarists who razed,1821
data/raw/iam/iam_01822.png,iam,genuine,cities . FRANCE - One can hardly conceive the French are,1822
data/raw/iam/iam_01823.png,iam,genuine,generals and officers .,1823
data/raw/iam/iam_01824.png,iam,genuine,"not alarmed ... . Next door , in West Germany , before everyone's",1824
data/raw/iam/iam_01825.png,iam,genuine,eyes there has sprung up a regular army led by former Nazi,1825
data/raw/iam/iam_01826.png,iam,genuine,BRITAIN - One cannot but wonder at British bases being,1826
data/raw/iam/iam_01827.png,iam,genuine,Coventry and barbarously bombed London and other British,1827
data/raw/iam/iam_01828.png,iam,genuine,contingency would be to sign a peace treaty to remove the cancerous,1828
data/raw/iam/iam_01829.png,iam,genuine,determination and tramples on Tunisians' right to independence .,1829
data/raw/iam/iam_01830.png,iam,genuine,realization that West Germany would not survive even a few hours,1830
data/raw/iam/iam_01831.png,iam,genuine,With fire and sword France denies Algeria the right to self-,1831
data/raw/iam/iam_01832.png,iam,genuine,growth of West Berlin's occupation status .,1832
data/raw/iam/iam_01833.png,iam,genuine,of a third world war . The best way to rule out such a tragic,1833
data/raw/iam/iam_01834.png,iam,genuine,WEST GERMANY - Russia would like to see a clear #,1834
data/raw/iam/iam_01835.png,iam,genuine,DURING MONDAY NIGHT . And officials,1835
data/raw/iam/iam_01836.png,iam,genuine,West Germany . REFUGEES are pouring out,1836
data/raw/iam/iam_01837.png,iam,genuine,"3,000 a day .",1837
data/raw/iam/iam_01838.png,iam,genuine,expect the total to leap to,1838
data/raw/iam/iam_01839.png,iam,genuine,Berlin faster than ever . Mr. K's latest,1839
data/raw/iam/iam_01840.png,iam,genuine,# of East Germany into West,1840
data/raw/iam/iam_01841.png,iam,genuine,determination is the intention to impose,1841
data/raw/iam/iam_01842.png,iam,genuine,Behind Bonn's slogan of German self-,1842
data/raw/iam/iam_01843.png,iam,genuine,on East Germany the regime existing in,1843
data/raw/iam/iam_01844.png,iam,genuine,"speech scared 1,157 East Germans to",1844
data/raw/iam/iam_01845.png,iam,genuine,cross into West Berlin's reception centre,1845
data/raw/iam/iam_01846.png,iam,genuine,"East German disturbances on July 17 , 1953 . And officials",1846
data/raw/iam/iam_01847.png,iam,genuine,fear it may be too much for the city's refugee camps .,1847
data/raw/iam/iam_01848.png,iam,genuine,This figure has been surpassed only on the eve of the,1848
data/raw/iam/iam_01849.png,iam,genuine,They will overflow and private houses will have to be used .,1849
data/raw/iam/iam_01850.png,iam,genuine,Commonwealth ? The issue is touch and go .,1850
data/raw/iam/iam_01851.png,iam,genuine,Prime Minister after Prime Minister speaks out,1851
data/raw/iam/iam_01852.png,iam,genuine,Conference in London . Will it end with,1852
data/raw/iam/iam_01853.png,iam,genuine,South Africa's exclusion from the,1853
data/raw/iam/iam_01854.png,iam,genuine,in revulsion against the South African,1854
data/raw/iam/iam_01855.png,iam,genuine,for the curtain to rise on the Commonwealth,1855
data/raw/iam/iam_01856.png,iam,genuine,Government's policy of apartheid as we wait,1856
data/raw/iam/iam_01857.png,iam,genuine,not clear-cut .,1857
data/raw/iam/iam_01858.png,iam,genuine,Republic later in the year . But if a final,1858
data/raw/iam/iam_01859.png,iam,genuine,do the strongest arguments lie ? THE Archbishop,1859
data/raw/iam/iam_01860.png,iam,genuine,of Capetown has shown that the matter is,1860
data/raw/iam/iam_01861.png,iam,genuine,wait until South Africa actually becomes a,1861
data/raw/iam/iam_01862.png,iam,genuine,"decision is to be faced now , on which side",1862
data/raw/iam/iam_01863.png,iam,genuine,settled at this conference . It may be agreed to,1863
data/raw/iam/iam_01864.png,iam,genuine,There is a possibility that it will not be,1864
data/raw/iam/iam_01865.png,iam,genuine,working for a change of policy . In his view,1865
data/raw/iam/iam_01866.png,iam,genuine,Africans .,1866
data/raw/iam/iam_01867.png,iam,genuine,it would also be against the interests of the,1867
data/raw/iam/iam_01868.png,iam,genuine,with attention . On purely practical grounds he,1868
data/raw/iam/iam_01869.png,iam,genuine,holds that it would be a mistake to expel,1869
data/raw/iam/iam_01870.png,iam,genuine,fighter against apartheid . He must be heard,1870
data/raw/iam/iam_01871.png,iam,genuine,"South Africa , weakening the whites who are",1871
data/raw/iam/iam_01872.png,iam,genuine,The Archbishop has long been a courageous,1872
data/raw/iam/iam_01873.png,iam,genuine,the apartheid policy .,1873
data/raw/iam/iam_01874.png,iam,genuine,Africa while she remains in the Commonwealth,1874
data/raw/iam/iam_01875.png,iam,genuine,Verwoerd and the Nationalists . They point out,1875
data/raw/iam/iam_01876.png,iam,genuine,"On the other hand , those who favour expulsion , inclu-",1876
data/raw/iam/iam_01877.png,iam,genuine,than could be exercised were she cut off from it .,1877
data/raw/iam/iam_01878.png,iam,genuine,that Dr. Verwoerd refuses to consider abandoning,1878
data/raw/iam/iam_01879.png,iam,genuine,"ding African leaders , feel that nothing less than the",1879
data/raw/iam/iam_01880.png,iam,genuine,shock of expulsion will weaken the grip of Dr.,1880
data/raw/iam/iam_01881.png,iam,genuine,He holds that more pressure can be put on South,1881
data/raw/iam/iam_01882.png,iam,genuine,a Commonwealth which had room for a racist,1882
data/raw/iam/iam_01883.png,iam,genuine,Whatever statesmen say at the conference table in,1883
data/raw/iam/iam_01884.png,iam,genuine,who is white .,1884
data/raw/iam/iam_01885.png,iam,genuine,policy of racial discrimination in any of its countries,1885
data/raw/iam/iam_01886.png,iam,genuine,which five citizens are coloured for every one,1886
data/raw/iam/iam_01887.png,iam,genuine,THE Commonwealth is a multi-racial society . A,1887
data/raw/iam/iam_01888.png,iam,genuine,South Africa . And this is a Commonwealth in,1888
data/raw/iam/iam_01889.png,iam,genuine,"London , millions at home would regard as fraudulent",1889
data/raw/iam/iam_01890.png,iam,genuine,is surely the one thing that it could not survive .,1890
data/raw/iam/iam_01891.png,iam,genuine,apartheid is a menace to the Commonwealth and a,1891
data/raw/iam/iam_01892.png,iam,genuine,liability to the whole Western world . A practical,1892
data/raw/iam/iam_01893.png,iam,genuine,a set of principles excluding race discrimination .,1893
data/raw/iam/iam_01894.png,iam,genuine,solution would be for the Commonwealth to draft,1894
data/raw/iam/iam_01895.png,iam,genuine,"Seen in this wider picture , a South Africa that clings to",1895
data/raw/iam/iam_01896.png,iam,genuine,or go out .,1896
data/raw/iam/iam_01897.png,iam,genuine,"And so leave South Africa to make the grade ,",1897
data/raw/iam/iam_01898.png,iam,genuine,have taken the headlines in this country .,1898
data/raw/iam/iam_01899.png,iam,genuine,"Nevertheless , the tour has been an immense",1899
data/raw/iam/iam_01900.png,iam,genuine,would be pleasanter if such cruel and feudal,1900
data/raw/iam/iam_01901.png,iam,genuine,tonight from their tour in the East . The duke's,1901
data/raw/iam/iam_01902.png,iam,genuine,THE Queen and the Duke of Edinburgh come home,1902
data/raw/iam/iam_01903.png,iam,genuine,dropped from future Royal programmes .,1903
data/raw/iam/iam_01904.png,iam,genuine,performances as tiger and rhino hunts were,1904
data/raw/iam/iam_01905.png,iam,genuine,trigger-finger and the ritual slaughter of beasts,1905
data/raw/iam/iam_01906.png,iam,genuine,success . The Queen has won a triumph . It,1906
data/raw/iam/iam_01907.png,iam,genuine,yesterday by the Dutch - has made the gesture,1907
data/raw/iam/iam_01908.png,iam,genuine,Pakistan are happy memories . WEST GERMANY - followed,1908
data/raw/iam/iam_01909.png,iam,genuine,of a good neighbour . She has put up the value,1909
data/raw/iam/iam_01910.png,iam,genuine,of her money .,1910
data/raw/iam/iam_01911.png,iam,genuine,their visit . The warmth of their welcome in India and,1911
data/raw/iam/iam_01912.png,iam,genuine,But the Queen and the Duke have pleased millions by,1912
data/raw/iam/iam_01913.png,iam,genuine,"their balances , will gain some immediate help .",1913
data/raw/iam/iam_01914.png,iam,genuine,Germany exports will be made a little dearer .,1914
data/raw/iam/iam_01915.png,iam,genuine,What it means in practical terms is that our,1915
data/raw/iam/iam_01916.png,iam,genuine,"for Germans to buy , while the goods which",1916
data/raw/iam/iam_01917.png,iam,genuine,in the direction of live-and-let-live . Hopes,1917
data/raw/iam/iam_01918.png,iam,genuine,"Certainly , the rise is very small . But it is a step",1918
data/raw/iam/iam_01919.png,iam,genuine,"co-operation , which is the only way to solve the",1919
data/raw/iam/iam_01920.png,iam,genuine,exports to Germany will now be a little cheaper,1920
data/raw/iam/iam_01921.png,iam,genuine,"Britain and the U.S. , which have problems with",1921
data/raw/iam/iam_01922.png,iam,genuine,payments difficulties that upset the Western world .,1922
data/raw/iam/iam_01923.png,iam,genuine,will now grow brighter of further international,1923
data/raw/iam/iam_01924.png,iam,genuine,dollars have been drained into Germany .,1924
data/raw/iam/iam_01925.png,iam,genuine,as a means to curb rising prices at home . She is,1925
data/raw/iam/iam_01926.png,iam,genuine,also aware how # unpopular she has been growing,1926
data/raw/iam/iam_01927.png,iam,genuine,should . Germany exports much more than she imports .,1927
data/raw/iam/iam_01928.png,iam,genuine,by failing until now to co-operate as a creditor nation,1928
data/raw/iam/iam_01929.png,iam,genuine,Booming Germany is deliberately encouraging more imports,1929
data/raw/iam/iam_01930.png,iam,genuine,For upwards of five years the world's reserves of,1930
data/raw/iam/iam_01931.png,iam,genuine,Germany's massive trading surplus and choke,1931
data/raw/iam/iam_01932.png,iam,genuine,the strength of Germany's trading position has attracted,1932
data/raw/iam/iam_01933.png,iam,genuine,off speculation against dollar and pound ?,1933
data/raw/iam/iam_01934.png,iam,genuine,Germany has no tradition of trading abroad . In addition,1934
data/raw/iam/iam_01935.png,iam,genuine,"hoping for the mark to rise , as has now happened .",1935
data/raw/iam/iam_01936.png,iam,genuine,There they have stayed uselessly locked up because,1936
data/raw/iam/iam_01937.png,iam,genuine,"speculators to hold marks rather than pounds or dollars ,",1937
data/raw/iam/iam_01938.png,iam,genuine,WILL the new valuation be enough to correct,1938
data/raw/iam/iam_01939.png,iam,genuine,"share in giving aid to underdeveloped nations , the",1939
data/raw/iam/iam_01940.png,iam,genuine,to optimism is the sign that Germany and the,1940
data/raw/iam/iam_01941.png,iam,genuine,world outlook will be brighter . What gives rise,1941
data/raw/iam/iam_01942.png,iam,genuine,"good-neighbour gesture , Germany takes a really big",1942
data/raw/iam/iam_01943.png,iam,genuine,other leading Western nations are at long last,1943
data/raw/iam/iam_01944.png,iam,genuine,moving towards a solution of currency problems,1944
data/raw/iam/iam_01945.png,iam,genuine,by co-operation .,1945
data/raw/iam/iam_01946.png,iam,genuine,"That is doubtful . If however , in addition to her new",1946
data/raw/iam/iam_01947.png,iam,genuine,idea that moral regeneration would solve,1947
data/raw/iam/iam_01948.png,iam,genuine,and our local and national Parliaments .,1948
data/raw/iam/iam_01949.png,iam,genuine,for by that curious body Moral Re-Armament .,1949
data/raw/iam/iam_01950.png,iam,genuine,"of politics , perhaps , or carried away by the",1950
data/raw/iam/iam_01951.png,iam,genuine,all our problems . So it would . While we are,1951
data/raw/iam/iam_01952.png,iam,genuine,Those who lend their names to this kind of,1952
data/raw/iam/iam_01953.png,iam,genuine,"waiting for the millenium , however , most of us",1953
data/raw/iam/iam_01954.png,iam,genuine,would prefer to put our hopes for earthly justice in,1954
data/raw/iam/iam_01955.png,iam,genuine,"instruments of democracy , such as trade unions",1955
data/raw/iam/iam_01956.png,iam,genuine,"advertisement are worthy people , a little innocent",1956
data/raw/iam/iam_01957.png,iam,genuine,"A CURIOUS advertisement on page nine , paid",1957
data/raw/iam/iam_01958.png,iam,genuine,"advertisement falls into neither category , though",1958
data/raw/iam/iam_01959.png,iam,genuine,"deeply repugnant to our readers , it is right to",1959
data/raw/iam/iam_01960.png,iam,genuine,exercise editorial discretion . The MRA,1960
data/raw/iam/iam_01961.png,iam,genuine,contains statements whose factual truth is,1961
data/raw/iam/iam_01962.png,iam,genuine,which we disagree . When an advertisement,1962
data/raw/iam/iam_01963.png,iam,genuine,Should the Herald publish such advertisements ?,1963
data/raw/iam/iam_01964.png,iam,genuine,"doubtful , or where the total content would be",1964
data/raw/iam/iam_01965.png,iam,genuine,many readers will dislike it .,1965
data/raw/iam/iam_01966.png,iam,genuine,be wrong to refuse all political advertisements with,1966
data/raw/iam/iam_01967.png,iam,genuine,This is a difficult question . It would obviously,1967
data/raw/iam/iam_01968.png,iam,genuine,Government was to denounce the United,1968
data/raw/iam/iam_01969.png,iam,genuine,"more logical to send in more men ,",1969
data/raw/iam/iam_01970.png,iam,genuine,would be taken home . The reaction can be,1970
data/raw/iam/iam_01971.png,iam,genuine,to say that its 400 troops in the Congo,1971
data/raw/iam/iam_01972.png,iam,genuine,a # dignified exit . IF the UN is,1972
data/raw/iam/iam_01973.png,iam,genuine,not weaken it further by desertion .,1973
data/raw/iam/iam_01974.png,iam,genuine,The first reaction of the Sudanese,1974
data/raw/iam/iam_01975.png,iam,genuine,"blamed for being weak , it would be",1975
data/raw/iam/iam_01976.png,iam,genuine,"Nations for "" negligence and impotence , "" and",1976
data/raw/iam/iam_01977.png,iam,genuine,understood . The Sudan's concern for its,1977
data/raw/iam/iam_01978.png,iam,genuine,men is natural . But this could hardly be,1978
data/raw/iam/iam_01979.png,iam,genuine,Mr. Hammarskjold to use force if necessary to,1979
data/raw/iam/iam_01980.png,iam,genuine,responsibility rightly belongs to the nations,1980
data/raw/iam/iam_01981.png,iam,genuine,which have undertaken the task of pre-,1981
data/raw/iam/iam_01982.png,iam,genuine,serving peace in the Congo . That is not a,1982
data/raw/iam/iam_01983.png,iam,genuine,"ceremonial duty , and the soldiers have every",1983
data/raw/iam/iam_01984.png,iam,genuine,It is unjust to pass the buck to Mr.,1984
data/raw/iam/iam_01985.png,iam,genuine,"prevent civil war , it was clear that new dangers",1985
data/raw/iam/iam_01986.png,iam,genuine,Hammarskjold and the UN's servants . The,1986
data/raw/iam/iam_01987.png,iam,genuine,would arise unless it gave him the political ...,1987
data/raw/iam/iam_01988.png,iam,genuine,right to blame the politicians unless they see,1988
data/raw/iam/iam_01989.png,iam,genuine,it through . When the United Nations instructed,1989
data/raw/iam/iam_01990.png,iam,genuine,made . India has responded handsomely by providing,1990
data/raw/iam/iam_01991.png,iam,genuine,"If the UN forces were thick enough on the ground ,",1991
data/raw/iam/iam_01992.png,iam,genuine,which have set their hands to this plough .,1992
data/raw/iam/iam_01993.png,iam,genuine,"3,000 men , who must take about a fortnight to arrive .",1993
data/raw/iam/iam_01994.png,iam,genuine,That was the first point that Mr. Hammarskjold,1994
data/raw/iam/iam_01995.png,iam,genuine,happen . THE UN's ability to keep peace depends,1995
data/raw/iam/iam_01996.png,iam,genuine,simply on adequate support by the nations,1996
data/raw/iam/iam_01997.png,iam,genuine,such incidents as that at Matadi would not,1997
data/raw/iam/iam_01998.png,iam,genuine,The big Powers involved in the Cold War,1998
data/raw/iam/iam_01999.png,iam,genuine,It is to be hoped that the UN will be,1999
data/raw/iam/iam_02000.png,iam,genuine,re-established in their port by negotiation,2000
data/raw/iam/iam_02001.png,iam,genuine,must of course keep out . The Americans were,2001
data/raw/iam/iam_02002.png,iam,genuine,non-combatant help was wanted ; but they,2002
data/raw/iam/iam_02003.png,iam,genuine,in fighting . Yesterday the ships turned away,2003
data/raw/iam/iam_02004.png,iam,genuine,justified in diverting naval ships in case,2004
data/raw/iam/iam_02005.png,iam,genuine,"again , satisfied that they were not required .",2005
data/raw/iam/iam_02006.png,iam,genuine,and that there will be no more outrages .,2006
data/raw/iam/iam_02007.png,iam,genuine,stressed that there was no intention to intervene,2007
data/raw/iam/iam_02008.png,iam,genuine,of UN conciliators they are meeting for,2008
data/raw/iam/iam_02009.png,iam,genuine,relief when this strife-torn land gets,2009
data/raw/iam/iam_02010.png,iam,genuine,Madagascar ) . THE world will sigh with,2010
data/raw/iam/iam_02011.png,iam,genuine,they must go . The best news for the Congo,2011
data/raw/iam/iam_02012.png,iam,genuine,"the first time , in Malagasy ( formerly",2012
data/raw/iam/iam_02013.png,iam,genuine,itself a government which all outsiders,2013
data/raw/iam/iam_02014.png,iam,genuine,can recognise .,2014
data/raw/iam/iam_02015.png,iam,genuine,"But back , Mr. Hammarskjold is determined ,",2015
data/raw/iam/iam_02016.png,iam,genuine,would be agreement between its rival,2016
data/raw/iam/iam_02017.png,iam,genuine,political leaders . Through the patient efforts,2017
data/raw/iam/iam_02018.png,iam,genuine,"who , under apartheid , will be forced back to",2018
data/raw/iam/iam_02019.png,iam,genuine,really believes . A good neighbour to those Africans,2019
data/raw/iam/iam_02020.png,iam,genuine,"policy of good neighbourliness . "" We may be sure that",2020
data/raw/iam/iam_02021.png,iam,genuine,"as a divine mission could have spoken of apartheid as "" a",2021
data/raw/iam/iam_02022.png,iam,genuine,their tribal reserves with no prospect but a,2022
data/raw/iam/iam_02023.png,iam,genuine,he is not being hypocritical . That is what he,2023
data/raw/iam/iam_02024.png,iam,genuine,ONLY a man wrapped in the impenetrable cocoon of what he regards,2024
data/raw/iam/iam_02025.png,iam,genuine,cramped and primitive existence .,2025
data/raw/iam/iam_02026.png,iam,genuine,white stock .,2026
data/raw/iam/iam_02027.png,iam,genuine,Hitler in the thirties . It was Dr. Verwoerd who,2027
data/raw/iam/iam_02028.png,iam,genuine,A good neighbour to those Africans who will con-,2028
data/raw/iam/iam_02029.png,iam,genuine,that he proved to be to the Jews fleeing from,2029
data/raw/iam/iam_02030.png,iam,genuine,"water in the white areas of South Africa , without rights",2030
data/raw/iam/iam_02031.png,iam,genuine,led a protest against admitting any of them,2031
data/raw/iam/iam_02032.png,iam,genuine,and without hope . THE same sort of good neighbour,2032
data/raw/iam/iam_02033.png,iam,genuine,"because they would "" defile "" the national",2033
data/raw/iam/iam_02034.png,iam,genuine,tinue to live as hewers of wood and drawers of,2034
data/raw/iam/iam_02035.png,iam,genuine,woerd in his nightmare world . It is this that,2035
data/raw/iam/iam_02036.png,iam,genuine,"Commonwealth . Otherwise , he says , those inside the",2036
data/raw/iam/iam_02037.png,iam,genuine,It is impossible to make contact with Dr. Ver-,2037
data/raw/iam/iam_02038.png,iam,genuine,makes illusory any hopes that he may be in-,2038
data/raw/iam/iam_02039.png,iam,genuine,"Capetown , Dr. Joost de Blank , has pleaded that",2039
data/raw/iam/iam_02040.png,iam,genuine,country who still oppose apartheid will be,2040
data/raw/iam/iam_02041.png,iam,genuine,South Africa should be allowed to stay in the,2041
data/raw/iam/iam_02042.png,iam,genuine,left even more isolated and alone .,2042
data/raw/iam/iam_02043.png,iam,genuine,fluenced to change course . The Archbishop of,2043
data/raw/iam/iam_02044.png,iam,genuine,maintained an unflinching witness to what,2044
data/raw/iam/iam_02045.png,iam,genuine,"Christianity really means , must carry weight . But",2045
data/raw/iam/iam_02046.png,iam,genuine,"what , in fact , can the other Commonwealth countries",2046
data/raw/iam/iam_02047.png,iam,genuine,policy of appeasement has modified the,2047
data/raw/iam/iam_02048.png,iam,genuine,"actions of the Nationalists . On the contrary ,",2048
data/raw/iam/iam_02049.png,iam,genuine,"The views of the Archbishop , who has",2049
data/raw/iam/iam_02050.png,iam,genuine,do to bring support and comfort to this gallant,2050
data/raw/iam/iam_02051.png,iam,genuine,minority ? THERE is no evidence that the,2051
data/raw/iam/iam_02052.png,iam,genuine,apartheid is being applied ever more,2052
data/raw/iam/iam_02053.png,iam,genuine,ruthlessly .,2053
data/raw/iam/iam_02054.png,iam,genuine,step . If that is their decision they should also,2054
data/raw/iam/iam_02055.png,iam,genuine,way left to try to bring home to the people of,2055
data/raw/iam/iam_02056.png,iam,genuine,to disaster . It may be that the Commonwealth,2056
data/raw/iam/iam_02057.png,iam,genuine,apartheid as evil and indefensible .,2057
data/raw/iam/iam_02058.png,iam,genuine,Commonwealth now seems to be the only,2058
data/raw/iam/iam_02059.png,iam,genuine,Prime Ministers will decide against this final,2059
data/raw/iam/iam_02060.png,iam,genuine,South Africa that Dr. Verwoerd is leading them,2060
data/raw/iam/iam_02061.png,iam,genuine,go unequivocally on record that they regard,2061
data/raw/iam/iam_02062.png,iam,genuine,The shock of expulsion from the,2062
data/raw/iam/iam_02063.png,iam,genuine,"without a story or a picture or probably both ,",2063
data/raw/iam/iam_02064.png,iam,genuine,be able to return home claiming a triumph .,2064
data/raw/iam/iam_02065.png,iam,genuine,"marry Miss Worsley , hardly a day will pass",2065
data/raw/iam/iam_02066.png,iam,genuine,for it again : another Royal Wedding . Between,2066
data/raw/iam/iam_02067.png,iam,genuine,His smile will be blander than ever . WE are in,2067
data/raw/iam/iam_02068.png,iam,genuine,"now and June , when the Duke of Kent will",2068
data/raw/iam/iam_02069.png,iam,genuine,about the nuptial arrangements .,2069
data/raw/iam/iam_02070.png,iam,genuine,"Unless they do at least that , Dr. Verwoerd will",2070
data/raw/iam/iam_02071.png,iam,genuine,disposed to face . The real question is,2071
data/raw/iam/iam_02072.png,iam,genuine,ought to run - and greater than President,2072
data/raw/iam/iam_02073.png,iam,genuine,advocate putting off any approach until,2073
data/raw/iam/iam_02074.png,iam,genuine,what we should put to the Soviet,2074
data/raw/iam/iam_02075.png,iam,genuine,Kennedy's most influential advisers seem,2075
data/raw/iam/iam_02076.png,iam,genuine,Government as a basis for talks : and,2076
data/raw/iam/iam_02077.png,iam,genuine,of heart ( whatever that may mean ) would,2077
data/raw/iam/iam_02078.png,iam,genuine,have us run risks greater than the West,2078
data/raw/iam/iam_02079.png,iam,genuine,What seems certain is that those who,2079
data/raw/iam/iam_02080.png,iam,genuine,Mr Krushchev gives evidence of a change,2080
data/raw/iam/iam_02081.png,iam,genuine,On this reading what Mr. Gollancz calls,2081
data/raw/iam/iam_02082.png,iam,genuine,a means not to destruction but to safety .,2082
data/raw/iam/iam_02083.png,iam,genuine,the Northern Rhodesia Constitution is,2083
data/raw/iam/iam_02084.png,iam,genuine,"on Northern Rhodesia does not say much ,",2084
data/raw/iam/iam_02085.png,iam,genuine,it by saying that the revision would be,2085
data/raw/iam/iam_02086.png,iam,genuine,much the Government tries to disguise,2086
