filepath,source,label,text,idx
data/raw/iam/iam_03250.png,iam,genuine,In Fanny the pregnant girl is befriended,3250
data/raw/iam/iam_03251.png,iam,genuine,by an old man . Here it is a young homo-,3251
data/raw/iam/iam_03252.png,iam,genuine,who acts as a protector and comforter to,3252
data/raw/iam/iam_03253.png,iam,genuine,"sexual , estranged from women but yet moved",3253
data/raw/iam/iam_03254.png,iam,genuine,by a strong maternal instinct to the unborn,3254
data/raw/iam/iam_03255.png,iam,genuine,to love you while you are looking for,3255
data/raw/iam/iam_03256.png,iam,genuine,"child as much as to the expectant mother ,",3256
data/raw/iam/iam_03257.png,iam,genuine,and gives her his forlorn gift of com-,3257
data/raw/iam/iam_03258.png,iam,genuine,"someone to love "" .",3258
data/raw/iam/iam_03259.png,iam,genuine,"panionship and sympathy - "" you need someone",3259
data/raw/iam/iam_03260.png,iam,genuine,her in her hour of need . He shares her room,3260
data/raw/iam/iam_03261.png,iam,genuine,by an old man . Here it is a young homo-,3261
data/raw/iam/iam_03262.png,iam,genuine,""" you need someone to love you while you",3262
data/raw/iam/iam_03263.png,iam,genuine,forlorn gift of companionship and sympathy -,3263
data/raw/iam/iam_03264.png,iam,genuine,and comforter to her in her hour of need .,3264
data/raw/iam/iam_03265.png,iam,genuine,"sexual , estranged from women but yet",3265
data/raw/iam/iam_03266.png,iam,genuine,moved by a strong maternal instinct to,3266
data/raw/iam/iam_03267.png,iam,genuine,"expectant mother , who acts as a protector",3267
data/raw/iam/iam_03268.png,iam,genuine,the unborn child as much as to the,3268
data/raw/iam/iam_03269.png,iam,genuine,He shares her room and gives her his,3269
data/raw/iam/iam_03270.png,iam,genuine,In Fanny the pregnant girl is befriended,3270
data/raw/iam/iam_03271.png,iam,genuine,"a flawed but beautiful enigma , seen but not",3271
data/raw/iam/iam_03272.png,iam,genuine,technical error in allowing Irene to speak,3272
data/raw/iam/iam_03273.png,iam,genuine,"that of the sergeant , gives a performance of",3273
data/raw/iam/iam_03274.png,iam,genuine,in our minds about her if she remained,3274
data/raw/iam/iam_03275.png,iam,genuine,for herself ; we would be altogether clearer,3275
data/raw/iam/iam_03276.png,iam,genuine,rare intelligence and restrained power .,3276
data/raw/iam/iam_03277.png,iam,genuine,"Arguably , the dramatist has committed a",3277
data/raw/iam/iam_03278.png,iam,genuine,"few brief scenes effective , and Mr. Dinsdale",3278
data/raw/iam/iam_03279.png,iam,genuine,"Landen , in the longest and most exacting role ,",3279
data/raw/iam/iam_03280.png,iam,genuine,"heard . However , Miss Pinkie Johnstone makes her",3280
data/raw/iam/iam_03281.png,iam,genuine,Miss Pinkie Johnstone makes her few brief scenes,3281
data/raw/iam/iam_03282.png,iam,genuine,herself ; we would be altogether clearer in our,3282
data/raw/iam/iam_03283.png,iam,genuine,and restrained power .,3283
data/raw/iam/iam_03284.png,iam,genuine,"the longest and most exacting role , that of the",3284
data/raw/iam/iam_03285.png,iam,genuine,"sergeant , gives a performance of rare intelligence",3285
data/raw/iam/iam_03286.png,iam,genuine,technical error in allowing Irene to speak for,3286
data/raw/iam/iam_03287.png,iam,genuine,"effective , and Mr. Dinsdale Landen , in",3287
data/raw/iam/iam_03288.png,iam,genuine,"beautiful enigma , seen but not heard . However ,",3288
data/raw/iam/iam_03289.png,iam,genuine,minds about her if she remained a flawed but,3289
data/raw/iam/iam_03290.png,iam,genuine,"Arguably , the dramatist has committed a",3290
data/raw/iam/iam_03291.png,iam,genuine,"enigma , seen but not heard . However , Miss Pinkie",3291
data/raw/iam/iam_03292.png,iam,genuine,"exacting role , that of the sergeant , gives a performance",3292
data/raw/iam/iam_03293.png,iam,genuine,error in allowing Irene to speak for herself ;,3293
data/raw/iam/iam_03294.png,iam,genuine,we would be altogether clearer in our minds,3294
data/raw/iam/iam_03295.png,iam,genuine,"Arguably , the dramatist has committed a technical",3295
data/raw/iam/iam_03296.png,iam,genuine,"Johnstone makes her few brief scenes effective , and",3296
data/raw/iam/iam_03297.png,iam,genuine,of rare intelligence and restrained power .,3297
data/raw/iam/iam_03298.png,iam,genuine,about her if she remained a flawed but beautiful,3298
data/raw/iam/iam_03299.png,iam,genuine,"Mr. Dinsdale Landen , in the longest and most",3299
data/raw/iam/iam_03300.png,iam,genuine,"Arguably , the dramatist has committed a",3300
data/raw/iam/iam_03301.png,iam,genuine,"a flawed but beautiful enigma , seen but",3301
data/raw/iam/iam_03302.png,iam,genuine,restrained power .,3302
data/raw/iam/iam_03303.png,iam,genuine,technical error in allowing Irene to speak,3303
data/raw/iam/iam_03304.png,iam,genuine,"exacting role , that of the sergeant , gives",3304
data/raw/iam/iam_03305.png,iam,genuine,"not heard . However , Miss Pinkie Johnstone",3305
data/raw/iam/iam_03306.png,iam,genuine,"Dinsdale Landen , in the longest and most",3306
data/raw/iam/iam_03307.png,iam,genuine,a performance of rare intelligence and,3307
data/raw/iam/iam_03308.png,iam,genuine,in our minds about her if she remained,3308
data/raw/iam/iam_03309.png,iam,genuine,for herself ; we would be altogether clearer,3309
data/raw/iam/iam_03310.png,iam,genuine,"makes her few brief scenes effective , and Mr.",3310
data/raw/iam/iam_03311.png,iam,genuine,"exacting role , that of the sergeant , gives a perfor-",3311
data/raw/iam/iam_03312.png,iam,genuine,in our minds about her if she remained,3312
data/raw/iam/iam_03313.png,iam,genuine,for herself ; we would be altogether clearer,3313
data/raw/iam/iam_03314.png,iam,genuine,"makes her few brief scenes effective , and",3314
data/raw/iam/iam_03315.png,iam,genuine,"Mr. Dinsdale Landen , in the longest and most",3315
data/raw/iam/iam_03316.png,iam,genuine,"a flawed but beautiful enigma , seen but",3316
data/raw/iam/iam_03317.png,iam,genuine,power .,3317
data/raw/iam/iam_03318.png,iam,genuine,mance of rare intelligence and restrained,3318
data/raw/iam/iam_03319.png,iam,genuine,"not heard . However , Miss Pinkie Johnstone",3319
data/raw/iam/iam_03320.png,iam,genuine,"Arguably , the dramatist has committed a",3320
data/raw/iam/iam_03321.png,iam,genuine,technical error in allowing Irene to speak,3321
data/raw/iam/iam_03322.png,iam,genuine,"Arguably , the dramatist has committed a",3322
data/raw/iam/iam_03323.png,iam,genuine,"flawed but beautiful enigma , seen but not",3323
data/raw/iam/iam_03324.png,iam,genuine,"makes her few brief scenes effective , and",3324
data/raw/iam/iam_03325.png,iam,genuine,"Mr. Dinsdale Landen , in the longest and most",3325
data/raw/iam/iam_03326.png,iam,genuine,"exacting role , that of the sergeant , gives a",3326
data/raw/iam/iam_03327.png,iam,genuine,for herself ; we would be altogether clearer,3327
data/raw/iam/iam_03328.png,iam,genuine,in our minds about her if she remained a,3328
data/raw/iam/iam_03329.png,iam,genuine,performance of rare intelligence and restrained,3329
data/raw/iam/iam_03330.png,iam,genuine,"heard . However , Miss Pinkie Johnstone",3330
data/raw/iam/iam_03331.png,iam,genuine,technical error in allowing Irene to speak,3331
data/raw/iam/iam_03332.png,iam,genuine,power of unbridled ambition .,3332
data/raw/iam/iam_03333.png,iam,genuine,on the not unfamiliar theme of the destructive,3333
data/raw/iam/iam_03334.png,iam,genuine,Mr. Bryan Stonehouse's production is quietly,3334
data/raw/iam/iam_03335.png,iam,genuine,"effective , giving full value to the formal elements",3335
data/raw/iam/iam_03336.png,iam,genuine,"them . Last night's play in the "" Play of the",3336
data/raw/iam/iam_03337.png,iam,genuine,"Week "" series on independent television , Then",3337
data/raw/iam/iam_03338.png,iam,genuine,of Betti's writing without over-emphasizing,3338
data/raw/iam/iam_03339.png,iam,genuine,"We Fall , by Mr. Paul Ferris , was a morality",3339
data/raw/iam/iam_03340.png,iam,genuine,"them . Last night's play in the "" Play of the",3340
data/raw/iam/iam_03341.png,iam,genuine,of Betti's writing without over-emphasizing,3341
data/raw/iam/iam_03342.png,iam,genuine,"Week "" series on independent television , Then",3342
data/raw/iam/iam_03343.png,iam,genuine,Mr. Bryan Stonehouse's production is quietly,3343
data/raw/iam/iam_03344.png,iam,genuine,"effective , giving full value to the formal elements",3344
data/raw/iam/iam_03345.png,iam,genuine,on the not unfamiliar theme of the destructive,3345
data/raw/iam/iam_03346.png,iam,genuine,"We Fall , by Mr. Paul Ferris , was a morality",3346
data/raw/iam/iam_03347.png,iam,genuine,power of unbridled ambition .,3347
data/raw/iam/iam_03348.png,iam,genuine,"Mr. Bryan Stonehouse's production is quietly effective ,",3348
data/raw/iam/iam_03349.png,iam,genuine,giving full value to the formal elements of Betti's,3349
data/raw/iam/iam_03350.png,iam,genuine,was a morality on the not unfamiliar theme of,3350
data/raw/iam/iam_03351.png,iam,genuine,the destructive power of unbridled ambition .,3351
data/raw/iam/iam_03352.png,iam,genuine,writing without over-emphasizing them . Last night's,3352
data/raw/iam/iam_03353.png,iam,genuine,"dent television , Then We Fall , by Mr. Paul Ferris ,",3353
data/raw/iam/iam_03354.png,iam,genuine,"play in the "" Play of the Week "" series on indepen-",3354
data/raw/iam/iam_03355.png,iam,genuine,""" Play of the Week "" series on independent",3355
data/raw/iam/iam_03356.png,iam,genuine,"ris , was a morality on the not unfamiliar",3356
data/raw/iam/iam_03357.png,iam,genuine,Mr. Bryan Stonehouse's production is quietly,3357
data/raw/iam/iam_03358.png,iam,genuine,ambition .,3358
data/raw/iam/iam_03359.png,iam,genuine,emphasizing them . Last night's play in the,3359
data/raw/iam/iam_03360.png,iam,genuine,"television , Then We Fall , by Mr. Paul Fer-",3360
data/raw/iam/iam_03361.png,iam,genuine,elements of Betti's writing without over-,3361
data/raw/iam/iam_03362.png,iam,genuine,"effective , giving full value to the formal",3362
data/raw/iam/iam_03363.png,iam,genuine,theme of the destructive power of unbridled,3363
data/raw/iam/iam_03364.png,iam,genuine,"them . Last night's play in the "" Play of the",3364
data/raw/iam/iam_03365.png,iam,genuine,"Week "" series on independent television , Then We",3365
data/raw/iam/iam_03366.png,iam,genuine,Mr. Bryan Stonehouse's production is quietly,3366
data/raw/iam/iam_03367.png,iam,genuine,the not unfamiliar theme of the destructive,3367
data/raw/iam/iam_03368.png,iam,genuine,"effective , giving full value to the formal elements",3368
data/raw/iam/iam_03369.png,iam,genuine,"Fall , by Mr. Paul Ferris , was a morality on",3369
data/raw/iam/iam_03370.png,iam,genuine,power of unbridled ambition .,3370
data/raw/iam/iam_03371.png,iam,genuine,of Betti's writing without over-emphasizing,3371
data/raw/iam/iam_03372.png,iam,genuine,formal elements of Betti's writing without,3372
data/raw/iam/iam_03373.png,iam,genuine,Mr. Bryan Stonehouse's production is,3373
data/raw/iam/iam_03374.png,iam,genuine,"quietly effective , giving full value to the",3374
data/raw/iam/iam_03375.png,iam,genuine,of unbridled ambition .,3375
data/raw/iam/iam_03376.png,iam,genuine,unfamiliar theme of the destructive power,3376
data/raw/iam/iam_03377.png,iam,genuine,"independent television , Then We Fall , by",3377
data/raw/iam/iam_03378.png,iam,genuine,"Mr. Paul Ferris , was a morality on the not",3378
data/raw/iam/iam_03379.png,iam,genuine,"in the "" Play of the Week "" series on",3379
data/raw/iam/iam_03380.png,iam,genuine,over-emphasizing them . Last night's play,3380
data/raw/iam/iam_03381.png,iam,genuine,treatments of its subject by attempting to,3381
data/raw/iam/iam_03382.png,iam,genuine,"It went , perhaps , some distance beyond most",3382
data/raw/iam/iam_03383.png,iam,genuine,generate a melodramatic inevitability which,3383
data/raw/iam/iam_03384.png,iam,genuine,way in which Mr. Ferris manipulated his,3384
data/raw/iam/iam_03385.png,iam,genuine,characters .,3385
data/raw/iam/iam_03386.png,iam,genuine,left its central character and the world,3386
data/raw/iam/iam_03387.png,iam,genuine,"around him in complete , unredeemable desolation .",3387
data/raw/iam/iam_03388.png,iam,genuine,succeeded if we had a little more faith in the,3388
data/raw/iam/iam_03389.png,iam,genuine,"We could , perhaps , say whether or not the attempt",3389
data/raw/iam/iam_03390.png,iam,genuine,way in which Mr. Ferris manipulated,3390
data/raw/iam/iam_03391.png,iam,genuine,"around him in complete , unredeemable desolation .",3391
data/raw/iam/iam_03392.png,iam,genuine,"It went , perhaps , some distance beyond most",3392
data/raw/iam/iam_03393.png,iam,genuine,his characters .,3393
data/raw/iam/iam_03394.png,iam,genuine,"We could , perhaps , say whether or not the attempt",3394
data/raw/iam/iam_03395.png,iam,genuine,generate a melodramatic inevitability which,3395
data/raw/iam/iam_03396.png,iam,genuine,treatments of its subject by attempting to,3396
data/raw/iam/iam_03397.png,iam,genuine,succeeded if we had a little more faith in the,3397
data/raw/iam/iam_03398.png,iam,genuine,left its central character and the world,3398
data/raw/iam/iam_03399.png,iam,genuine,Ferris manipulated his characters .,3399
data/raw/iam/iam_03400.png,iam,genuine,"It went , perhaps , some distance beyond most treatments",3400
data/raw/iam/iam_03401.png,iam,genuine,dramatic inevitability which left its central character,3401
data/raw/iam/iam_03402.png,iam,genuine,"mable desolation . We could , perhaps , say whether",3402
data/raw/iam/iam_03403.png,iam,genuine,little more faith in the way in which Mr.,3403
data/raw/iam/iam_03404.png,iam,genuine,"and the world around him in complete , unredee-",3404
data/raw/iam/iam_03405.png,iam,genuine,of its subject by attempting to generate a melo-,3405
data/raw/iam/iam_03406.png,iam,genuine,or not the attempt succeeded if we had a,3406
data/raw/iam/iam_03407.png,iam,genuine,"unredeemable desolation . We could , perhaps ,",3407
data/raw/iam/iam_03408.png,iam,genuine,of we had a little more faith in the,3408
data/raw/iam/iam_03409.png,iam,genuine,inevitability which left its central character,3409
data/raw/iam/iam_03410.png,iam,genuine,most treatments of its subject by,3410
data/raw/iam/iam_03411.png,iam,genuine,his characters .,3411
data/raw/iam/iam_03412.png,iam,genuine,way in which Mr. Ferris manipulated,3412
data/raw/iam/iam_03413.png,iam,genuine,attempting to generate a melodramatic,3413
data/raw/iam/iam_03414.png,iam,genuine,say whether or not the attempt succeeded,3414
data/raw/iam/iam_03415.png,iam,genuine,"It went , perhaps , some distance beyond",3415
data/raw/iam/iam_03416.png,iam,genuine,"and the world around him in complete ,",3416
data/raw/iam/iam_03417.png,iam,genuine,treatments of its subject by attempting to,3417
data/raw/iam/iam_03418.png,iam,genuine,"solation . We could , perhaps , say whether or not",3418
data/raw/iam/iam_03419.png,iam,genuine,"It went , perhaps , some distance beyond most",3419
data/raw/iam/iam_03420.png,iam,genuine,pulated his characters .,3420
data/raw/iam/iam_03421.png,iam,genuine,faith in the way in which Mr. Ferris mani-,3421
data/raw/iam/iam_03422.png,iam,genuine,the attempt succeeded if we had a little more,3422
data/raw/iam/iam_03423.png,iam,genuine,"around him in complete , unredeemable de-",3423
data/raw/iam/iam_03424.png,iam,genuine,generate a melodramatic inevitability,3424
data/raw/iam/iam_03425.png,iam,genuine,which left its central character and the world,3425
data/raw/iam/iam_03426.png,iam,genuine,"world around him in complete , unredeemable",3426
data/raw/iam/iam_03427.png,iam,genuine,which left its central character and the,3427
data/raw/iam/iam_03428.png,iam,genuine,to generate a melodramatic inevitability,3428
data/raw/iam/iam_03429.png,iam,genuine,little more faith in the way in which Mr.,3429
data/raw/iam/iam_03430.png,iam,genuine,or not the attempt succeeded if we had a,3430
data/raw/iam/iam_03431.png,iam,genuine,"desolation . We could , perhaps , say whether",3431
data/raw/iam/iam_03432.png,iam,genuine,Ferris manipulated his characters .,3432
data/raw/iam/iam_03433.png,iam,genuine,most treatments of its subject by attempting,3433
data/raw/iam/iam_03434.png,iam,genuine,"It went , perhaps , some distance beyond",3434
data/raw/iam/iam_03435.png,iam,genuine,Mr. William Lucas ( Morris ) is always insensi-,3435
data/raw/iam/iam_03436.png,iam,genuine,suitably gaudy colour .,3436
data/raw/iam/iam_03437.png,iam,genuine,"the editor , always comically abashed by the",3437
data/raw/iam/iam_03438.png,iam,genuine,"always palely appealing , Mr. James Maxwell ,",3438
data/raw/iam/iam_03439.png,iam,genuine,"but played with proper efficiency and , in",3439
data/raw/iam/iam_03440.png,iam,genuine,"tively pushing , Miss Sheila Allen his wife ,",3440
data/raw/iam/iam_03441.png,iam,genuine,not asked to modulate from their set moods,3441
data/raw/iam/iam_03442.png,iam,genuine,"the case of Mr. Richards , with lavish and",3442
data/raw/iam/iam_03443.png,iam,genuine,"law , always comically grotesque ; they were",3443
data/raw/iam/iam_03444.png,iam,genuine,"events , and Mr. Aubrey Richards , the father-in-",3444
data/raw/iam/iam_03445.png,iam,genuine,colour .,3445
data/raw/iam/iam_03446.png,iam,genuine,"the editor , always comically abashed by the",3446
data/raw/iam/iam_03447.png,iam,genuine,Mr. William Lucas ( Morris ) is always,3447
data/raw/iam/iam_03448.png,iam,genuine,"events , and Mr. Aubrey Richards , the father-in-law ,",3448
data/raw/iam/iam_03449.png,iam,genuine,to modulate from their set moods but played,3449
data/raw/iam/iam_03450.png,iam,genuine,always comically grotesque ; they were not asked,3450
data/raw/iam/iam_03451.png,iam,genuine,"wife , always palely appealing , Mr. James Maxwell ,",3451
data/raw/iam/iam_03452.png,iam,genuine,"Richards , with lavish and suitably gaudy",3452
data/raw/iam/iam_03453.png,iam,genuine,"insensitively pushing , Miss Sheila Allen his",3453
data/raw/iam/iam_03454.png,iam,genuine,"with proper efficiency and , in the case of Mr.",3454
data/raw/iam/iam_03455.png,iam,genuine,Mr. William Lucas ( Morris ) is always insensitively,3455
data/raw/iam/iam_03456.png,iam,genuine,"Richards , the father-in-law , always comically",3456
data/raw/iam/iam_03457.png,iam,genuine,"appealing , Mr. James Maxwell , the editor , always",3457
data/raw/iam/iam_03458.png,iam,genuine,"ciency and , in the case of Mr. Richards , with",3458
data/raw/iam/iam_03459.png,iam,genuine,their set moods but played with proper effi-,3459
data/raw/iam/iam_03460.png,iam,genuine,"pushing , Miss Sheila Allen his wife , always palely",3460
data/raw/iam/iam_03461.png,iam,genuine,grotesque ; they were not asked to modulate from,3461
data/raw/iam/iam_03462.png,iam,genuine,"comically abashed by the events , and Mr. Aubrey",3462
data/raw/iam/iam_03463.png,iam,genuine,lavish and suitably gaudy colour .,3463
data/raw/iam/iam_03464.png,iam,genuine,"his wife , always palely appealing , Mr.",3464
data/raw/iam/iam_03465.png,iam,genuine,"James Maxwell , the editor , always comi-",3465
data/raw/iam/iam_03466.png,iam,genuine,and suitably gaudy colour .,3466
data/raw/iam/iam_03467.png,iam,genuine,asked to modulate from their set moods,3467
data/raw/iam/iam_03468.png,iam,genuine,"Aubrey Richards , the father-in-law , always",3468
data/raw/iam/iam_03469.png,iam,genuine,Mr. William Lucas ( Morris ) is always,3469
data/raw/iam/iam_03470.png,iam,genuine,"cally abashed by the events , and Mr.",3470
data/raw/iam/iam_03471.png,iam,genuine,"but played with proper efficiency and ,",3471
data/raw/iam/iam_03472.png,iam,genuine,"in the case of Mr. Richards , with lavish",3472
data/raw/iam/iam_03473.png,iam,genuine,comically grotesque ; they were not,3473
data/raw/iam/iam_03474.png,iam,genuine,"insensitively pushing , Miss Sheila Allen",3474
data/raw/iam/iam_03475.png,iam,genuine,"the events , and Mr. Aubrey Richards , the",3475
data/raw/iam/iam_03476.png,iam,genuine,"efficiency and , in the case of Mr. Richards ,",3476
data/raw/iam/iam_03477.png,iam,genuine,with lavish and suitably gaudy colour .,3477
data/raw/iam/iam_03478.png,iam,genuine,"the editor , always comically abashed by",3478
data/raw/iam/iam_03479.png,iam,genuine,"always palely appealing , Mr. James Maxwell ,",3479
data/raw/iam/iam_03480.png,iam,genuine,"sitively pushing , Miss Sheila Allen his wife ,",3480
data/raw/iam/iam_03481.png,iam,genuine,they were not asked to modulate from,3481
data/raw/iam/iam_03482.png,iam,genuine,"father-in-law , always comically grotesque ;",3482
data/raw/iam/iam_03483.png,iam,genuine,Mr. William Lucas ( Morris ) is always insen-,3483
data/raw/iam/iam_03484.png,iam,genuine,their set moods but played with proper,3484
data/raw/iam/iam_03485.png,iam,genuine,"tively pushing , Miss Sheila Allen his wife ,",3485
data/raw/iam/iam_03486.png,iam,genuine,their set moods but played with proper,3486
data/raw/iam/iam_03487.png,iam,genuine,"father-in-law , always comically grotesque ;",3487
data/raw/iam/iam_03488.png,iam,genuine,they were not asked to modulate from,3488
data/raw/iam/iam_03489.png,iam,genuine,Mr. William Lucas ( Morris ) is always insensi-,3489
data/raw/iam/iam_03490.png,iam,genuine,with lavish and suitably gaudy colour .,3490
data/raw/iam/iam_03491.png,iam,genuine,"the events , and Mr. Aubrey Richards , the",3491
data/raw/iam/iam_03492.png,iam,genuine,"efficiency and , in the case of Mr. Richards ,",3492
data/raw/iam/iam_03493.png,iam,genuine,"always palely appealing , Mr. James Maxwell ,",3493
data/raw/iam/iam_03494.png,iam,genuine,"the editor , always comically abashed by",3494
data/raw/iam/iam_03495.png,iam,genuine,"one feels , were driven to effective action by",3495
data/raw/iam/iam_03496.png,iam,genuine,tradition .,3496
data/raw/iam/iam_03497.png,iam,genuine,act oddly like the queer foreigners of,3497
data/raw/iam/iam_03498.png,iam,genuine,with which he had endowed them . One,3498
data/raw/iam/iam_03499.png,iam,genuine,"that , because of their odd accents , they",3499
data/raw/iam/iam_03500.png,iam,genuine,"Only Mr. Lucas's actions , therefore , arose",3500
data/raw/iam/iam_03501.png,iam,genuine,"explicably from appreciable motives . The rest ,",3501
data/raw/iam/iam_03502.png,iam,genuine,hopes that he is not asking us to believe,3502
data/raw/iam/iam_03503.png,iam,genuine,the author in spite of the ineffectuality,3503
data/raw/iam/iam_03504.png,iam,genuine,"Only Mr. Lucas's actions , therefore , arose",3504
data/raw/iam/iam_03505.png,iam,genuine,like the queer foreigners of tradition .,3505
data/raw/iam/iam_03506.png,iam,genuine,"that he is not asking us to believe that ,",3506
data/raw/iam/iam_03507.png,iam,genuine,by the author in spite of the ineffectuality,3507
data/raw/iam/iam_03508.png,iam,genuine,with which he had endowed them . One hopes,3508
data/raw/iam/iam_03509.png,iam,genuine,"because of their odd accents , they act oddly",3509
data/raw/iam/iam_03510.png,iam,genuine,"rest , one feels , were driven to effective action",3510
data/raw/iam/iam_03511.png,iam,genuine,explicably from appreciable motives . The,3511
data/raw/iam/iam_03512.png,iam,genuine,"Only Mr. Lucas's actions , therefore , arose explicably",3512
data/raw/iam/iam_03513.png,iam,genuine,"accents , they act oddly like the queer foreigners",3513
data/raw/iam/iam_03514.png,iam,genuine,"from appreciable motives . The rest , one feels , were",3514
data/raw/iam/iam_03515.png,iam,genuine,endowed them . One hopes that he is not,3515
data/raw/iam/iam_03516.png,iam,genuine,of tradition .,3516
data/raw/iam/iam_03517.png,iam,genuine,"asking us to believe that , because of their odd",3517
data/raw/iam/iam_03518.png,iam,genuine,driven to effective action by the author in spite,3518
data/raw/iam/iam_03519.png,iam,genuine,of the ineffectuality with which he had,3519
data/raw/iam/iam_03520.png,iam,genuine,them . One hopes that he is not asking,3520
data/raw/iam/iam_03521.png,iam,genuine,"rest , one feels , were driven to effective",3521
data/raw/iam/iam_03522.png,iam,genuine,ineffectuality with which he had endowed,3522
data/raw/iam/iam_03523.png,iam,genuine,foreigners of tradition .,3523
data/raw/iam/iam_03524.png,iam,genuine,"accents , they act oddly like the queer",3524
data/raw/iam/iam_03525.png,iam,genuine,action by the author in spite of the,3525
data/raw/iam/iam_03526.png,iam,genuine,explicably from appreciable motives . The,3526
data/raw/iam/iam_03527.png,iam,genuine,"us to believe that , because of their odd",3527
data/raw/iam/iam_03528.png,iam,genuine,"Only Mr. Lucas's actions , therefore , arose",3528
data/raw/iam/iam_03529.png,iam,genuine,"is not asking us to believe that , because of",3529
data/raw/iam/iam_03530.png,iam,genuine,"Only Mr. Lucas's actions , therefore , arose",3530
data/raw/iam/iam_03531.png,iam,genuine,queer foreigners of tradition .,3531
data/raw/iam/iam_03532.png,iam,genuine,the author in spite of the ineffectuality with,3532
data/raw/iam/iam_03533.png,iam,genuine,explicably from appreciable motives . The,3533
data/raw/iam/iam_03534.png,iam,genuine,"their odd accents , they act oddly like the",3534
data/raw/iam/iam_03535.png,iam,genuine,which he had endowed them . One hopes that he,3535
data/raw/iam/iam_03536.png,iam,genuine,"rest , one feels , were driven to effective action by",3536
data/raw/iam/iam_03537.png,iam,genuine,them . One hopes that he is not asking us,3537
data/raw/iam/iam_03538.png,iam,genuine,action by the author in spite of the,3538
data/raw/iam/iam_03539.png,iam,genuine,"Only Mr. Lucas's actions , therefore , arose",3539
data/raw/iam/iam_03540.png,iam,genuine,"accents , they act oddly like the queer",3540
data/raw/iam/iam_03541.png,iam,genuine,"rest , one feels , were driven to effective",3541
data/raw/iam/iam_03542.png,iam,genuine,foreigners of tradition .,3542
data/raw/iam/iam_03543.png,iam,genuine,explicably from appreciable motives . The,3543
data/raw/iam/iam_03544.png,iam,genuine,"to believe that , because of their odd",3544
